keyword,affiliate_url,affiliate_text
investing in gold,https://affiliate.example.com/gold-broker,أفضل منصة للوساطة في الذهب
public speaking skills,https://affiliate.example.com/course-speaking,الدورة التدريبية الشاملة للتحدث
AI in marketing,https://affiliate.example.com/ai-tool,أداة الذكاء الاصطناعي لتحليل التسويق
effective time management,https://affiliate.example.com/productivity-app,تطبيق الإنتاجية وإدارة الوقت
learning to code,https://affiliate.example.com/coding-bootcamp,المعسكر التدريبي لتعلم البرمجة
